{
  "schemaVersion": 1,
  "id": "site-blockout.wave-03a.warden-reed",
  "siteId": "site.warden-reed",
  "title": "Warden Reed service house and four-bank visibility exchange",
  "claims": {
    "canonical": false,
    "runtimeIntegrated": false,
    "constructionReady": false,
    "productionGeometry": false,
    "atlasExportEligible": false,
    "releaseReady": false,
    "authorSelfApproval": false,
    "integrationAuthorized": false
  },
  "authority": {
    "classification": "noncanonical_site_local_reference",
    "precedence": [
      "The atlas owns the Warden Reed site anchor, Dunmire containment, Reedward Causeway alignment, and drowned-mire habitat envelope.",
      "world-spatial.data.js owns the site envelope, Dunmire stilt-house language, activity cycle, environmental law, and authored design constraints.",
      "the accepted Wave 04 quest and environment records own quest identity, semantic anchors, directed edges, objective endpoints, creature counts, and failure semantics.",
      "this record owns only a relocatable two-structure site-local interpretation for review and may not mutate upstream authority."
    ],
    "consumer": "downstream world blockout planning after coordinator and independent spatial review",
    "relocationRule": "The complete local frame may translate or rotate within the authored site envelope; room IDs, source bindings, two independent egress domains, and quest crosswalk hashes must survive unchanged."
  },
  "sourceBindings": [
    {
      "id": "source.atlas.warden-reed",
      "path": "packages/content/manifests/sable-reach.atlas-runtime.json",
      "sha256": "a55f59a7ec10d1e8485e4d3f0cdec058698508a4ba89804038c087a1b0b3671b",
      "bytes": 198431,
      "selector": "sites[id=site.warden-reed]",
      "recordSha256": "ee9b7c244661b4817464e5a029988e8dae3b5655d775d52b71117356ec8ef3e7",
      "authority": "canon"
    },
    {
      "id": "source.atlas.reedward-causeway",
      "path": "packages/content/manifests/sable-reach.atlas-runtime.json",
      "sha256": "a55f59a7ec10d1e8485e4d3f0cdec058698508a4ba89804038c087a1b0b3671b",
      "bytes": 198431,
      "selector": "routes[id=route.reedward-causeway]",
      "recordSha256": "c7f384d7dab08da7baa2ace417d950bc9d7722f7d7679847945073f90b4739f7",
      "authority": "canon"
    },
    {
      "id": "source.atlas.drowned-mire",
      "path": "packages/content/manifests/sable-reach.atlas-runtime.json",
      "sha256": "a55f59a7ec10d1e8485e4d3f0cdec058698508a4ba89804038c087a1b0b3671b",
      "bytes": 198431,
      "selector": "habitats[id=habitat.drowned-mire]",
      "recordSha256": "f9f4c623b0d1ce2b3a18256d5228319876229ca6caffe1f1470a3a5e1c8ef554",
      "authority": "canon"
    },
    {
      "id": "source.world-spatial.warden-reed-envelope",
      "path": "packages/content/src/world-spatial.data.js",
      "sha256": "99e9048de9de3adc966f6da86d3949f6edf2cc3c16ca0b733cb24b38f43b3928",
      "bytes": 140285,
      "selector": "SITE_SPATIAL_ENVELOPES[id=site.warden-reed]",
      "recordSha256": "795d8edfe50d9cf8b980fc48a5f78cb31f53e38245b86381aa250eae44111c9a",
      "authority": "authored_design_constraint"
    },
    {
      "id": "source.world-spatial.warden-reed-activity",
      "path": "packages/content/src/world-spatial.data.js",
      "sha256": "99e9048de9de3adc966f6da86d3949f6edf2cc3c16ca0b733cb24b38f43b3928",
      "bytes": 140285,
      "selector": "SITE_ACTIVITY_CYCLES[siteId=site.warden-reed]",
      "recordSha256": "74c904740d6dad228a90c59f082ed82aa579b15a165f35dd3c0558cc695d672f",
      "authority": "authored_design_constraint"
    },
    {
      "id": "source.world-spatial.dunmire-stilt-house",
      "path": "packages/content/src/world-spatial.data.js",
      "sha256": "99e9048de9de3adc966f6da86d3949f6edf2cc3c16ca0b733cb24b38f43b3928",
      "bytes": 140285,
      "selector": "BUILDING_TYPOLOGIES[id=dunmire_stilt_house]",
      "recordSha256": "30a733fde057bc806a9fc712947bd8b554799f1af3fb2917ba8718fb040fa4ee",
      "authority": "authored_design_constraint"
    },
    {
      "id": "source.quest-wave-04.warden-reed-quest",
      "path": "design-review/quest-release-evidence/quest-wave-04-v11.machine-annex.json",
      "sha256": "12183ae9cbded83a65503c42b32c75f4824fad80c0da5f6c5340abd6dce11962",
      "bytes": 4245855,
      "selector": "quests[id=regional_the_fog_came_to_collect_our_outlines]",
      "recordSha256": "920d2976af13e05d6caa2cd532e3f0ae2fa50a982f838a8e50fecbf73429ed95",
      "authority": "accepted_quest_contract"
    },
    {
      "id": "source.quest-wave-04.warden-reed-environment",
      "path": "design-review/quest-release-evidence/quest-wave-04-v11.machine-annex.json",
      "sha256": "12183ae9cbded83a65503c42b32c75f4824fad80c0da5f6c5340abd6dce11962",
      "bytes": 4245855,
      "selector": "environmentPrograms[locationId=warden_reed_four_bank_visibility]",
      "recordSha256": "0c56265b4f7bfa3845f14ef573d050bea7335dce0792db7084979fa196fb52ac",
      "authority": "accepted_quest_contract"
    }
  ],
  "spatialReference": {
    "coordinateSpaceId": "veyl_local_grid_v1",
    "coordinateSemantics": "candidate_site_local_fictional_meters",
    "axes": {
      "x": "local east",
      "y": "local north",
      "z": "local up"
    },
    "unit": "meter",
    "atlasSiteAnchor": [4864, 4352, 68],
    "localOriginAtlasCoordinate": [4940, 4266, 72],
    "localBoundsMeters": {
      "minimum": [-160, -108, -1],
      "maximum": [160, 102, 14]
    },
    "placementStatus": "candidate_relocatable_not_atlas_geometry",
    "precisionNotice": "Coordinates describe a fictional candidate blockout derived from the accepted quest reservation; they are neither surveyed data nor an exact atlas placement claim."
  },
  "anchorPlacements": [
    { "anchorId": "anchor.warden_reed_four_bank_visibility.bank_a", "portId": "port.warden-reed.bank-a", "localCoordinateMeters": [-132, -74, 4], "macroRoomId": "room.warden-reed.exchange.bank-a-deck", "placementKind": "room_port" },
    { "anchorId": "anchor.warden_reed_four_bank_visibility.bank_b", "portId": "port.warden-reed.bank-b", "localCoordinateMeters": [-40, -28, 2], "macroRoomId": "room.warden-reed.exchange.bank-b-ferry-deck", "placementKind": "room_port" },
    { "anchorId": "anchor.warden_reed_four_bank_visibility.bank_c", "portId": "port.warden-reed.bank-c", "localCoordinateMeters": [46, 16, 5], "macroRoomId": "room.warden-reed.exchange.bank-c-household-deck", "placementKind": "room_port" },
    { "anchorId": "anchor.warden_reed_four_bank_visibility.bank_d", "portId": "port.warden-reed.bank-d", "localCoordinateMeters": [132, 68, 7], "macroRoomId": "room.warden-reed.exchange.bank-d-dark-watch", "placementKind": "room_port" },
    { "anchorId": "anchor.warden_reed_four_bank_visibility.causeway", "portId": "port.warden-reed.causeway", "localCoordinateMeters": [70, -58, 1], "macroRoomId": "room.warden-reed.exchange.bank-c-household-deck", "placementKind": "room_port" },
    { "anchorId": "anchor.warden_reed_four_bank_visibility.dark_bank", "portId": "port.warden-reed.dark-bank", "localCoordinateMeters": [124, -20, 4], "macroRoomId": "room.warden-reed.exchange.bank-d-dark-watch", "placementKind": "room_port" },
    { "anchorId": "anchor.warden_reed_four_bank_visibility.delivery", "portId": "port.warden-reed.delivery", "localCoordinateMeters": [-118, -104, 0], "macroRoomId": "room.warden-reed.exchange.bank-b-ferry-deck", "placementKind": "room_port" },
    { "anchorId": "anchor.warden_reed_four_bank_visibility.egress_a", "portId": "port.warden-reed.egress-a", "localCoordinateMeters": [-158, 94, 7], "macroRoomId": null, "placementKind": "external_destination" },
    { "anchorId": "anchor.warden_reed_four_bank_visibility.egress_b", "portId": "port.warden-reed.egress-b", "localCoordinateMeters": [158, -92, 1], "macroRoomId": null, "placementKind": "external_destination" },
    { "anchorId": "anchor.warden_reed_four_bank_visibility.egress_domain_a", "portId": "port.warden-reed.egress-domain-a", "localCoordinateMeters": [-49.2, 99.1, 8.95], "macroRoomId": null, "placementKind": "interior_egress_vertex" },
    { "anchorId": "anchor.warden_reed_four_bank_visibility.egress_domain_b", "portId": "port.warden-reed.egress-domain-b", "localCoordinateMeters": [53.5, 27.7, 6.85], "macroRoomId": null, "placementKind": "interior_egress_vertex" },
    { "anchorId": "anchor.warden_reed_four_bank_visibility.ferry", "portId": "port.warden-reed.ferry", "localCoordinateMeters": [-18, -100, 0], "macroRoomId": "room.warden-reed.exchange.bank-b-ferry-deck", "placementKind": "room_port" },
    { "anchorId": "anchor.warden_reed_four_bank_visibility.frame_ab", "portId": "port.warden-reed.frame-ab", "localCoordinateMeters": [-84, -50, 3], "macroRoomId": "room.warden-reed.exchange.ledger-frame-gallery", "placementKind": "room_port" },
    { "anchorId": "anchor.warden_reed_four_bank_visibility.frame_cd", "portId": "port.warden-reed.frame-cd", "localCoordinateMeters": [88, 42, 6], "macroRoomId": "room.warden-reed.exchange.ledger-frame-gallery", "placementKind": "room_port" },
    { "anchorId": "anchor.warden_reed_four_bank_visibility.ledger", "portId": "port.warden-reed.ledger", "localCoordinateMeters": [0, 52, 7], "macroRoomId": "room.warden-reed.exchange.ledger-frame-gallery", "placementKind": "room_port" },
    { "anchorId": "anchor.warden_reed_four_bank_visibility.maintenance", "portId": "port.warden-reed.maintenance", "localCoordinateMeters": [18, -60, -1], "macroRoomId": "room.warden-reed.service-house.boat-hatch", "placementKind": "room_port" },
    { "anchorId": "anchor.warden_reed_four_bank_visibility.refuge", "portId": "port.warden-reed.refuge", "localCoordinateMeters": [4, 96, 10], "macroRoomId": "room.warden-reed.exchange.raised-refuge", "placementKind": "room_port" },